model                                                  ,price   ,depreciation ,milleage ,registration_date ,coe_left ,no_of_owner ,omv    ,arf     ,power ,capacity ,accessories
MITSUBISHI OUTLANDER 2.0 CVT                           ,  95000 ,       17745 ,   47000 ,30-Nov-2018       ,     4.7 ,          1 , 22527 ,  23538 , 1100 ,    1998 ,"Sports rims, leather seats, media player with Apple CarPlay/Android, retractable side mirrors, rear aircon, reverse camera."
BMW X1 SDRIVE 2.0 A                                    ,  50000 ,       19859 ,  127000 ,29-Sep-2016       ,     2.5 ,          3 , 12303 ,  12303 , 1100 ,    1995 ,"Auto Head Lights, Electric Folding Side Mirrors, Multi-function Steering Wheel, Keyless Entry and Keyless Engine Start"
PORSCHE CARRERA S CABRIOLET PDK                        , 318000 ,       46317 ,   70000 ,02-Mar-2011       ,     6.9 ,          2 ,141939 , 141939 , 2830 ,    3800 ,"Multi-function Steering Wheel, Stock Rims, Flawless Brown Leather Interior"
HONDA ODYSSEY 2.4 EX-S CVT                             ,  50000 ,       24403 ,  111000 ,28-Sep-2015       ,     1.5 ,          1 , 24326 ,  26057 , 1290 ,    2356 ,"Electric Folding Side Mirrors, Multi-function Steering Wheel, Keyless Entry and Engine Start, Driver's Electric Seat, Electric Tailgate"
AUDI A3 SEDAN 1.4 TFSI AMBIENTE MY 15                  ,  26800 ,       19264 ,  126000 ,24-Mar-2015       ,     1.0 ,          2 , 27195 ,  15073 ,  920 ,    1395 ,"Electric Folding Side Mirrors, paddle shifters. original leather upholstery, park assist, climatic aircon with rear vents"
PORSCHE MACAN II PDK E6                                , 313000 ,       39295 ,   36000 ,24-Feb-2021       ,     6.9 ,          2 , 60932 ,  81678 , 1850 ,    1984 ,"Keyless entry/start, reverse camera, navi, auto tailgate, LED headlamps with 4-point DRL, cruise control, sports chrono package."
PORSCHE 911 CARRERA COUPE (992) PDK                    , 528000 ,       73126 ,   43000 ,27-Feb-2020       ,     5.9 ,          2 ,120055 , 188099 , 2830 ,    2981 ,sport chrono package. Multi function steering. memory seat and many more !! very well taken car by owner. view to believe !! Full service by Agent !!
BMW 216I GRAN TOURER                                   , 115800 ,       17499 ,   67665 ,18-Oct-2019       ,     5.6 ,          1 , 31833 ,  36567 ,  800 ,    1499 ,"Leather seats, factory fitted audio systems, Bluetooth, power seats, navigation, in car cameras, reverse camera, auto sensor boot open/close."
LEXUS LS350 LUXURY MR (AUTO)                           , 215000 ,       30113 ,   74300 ,19-Nov-2018       ,     4.7 ,          3 , 98518 , 149333 , 2320 ,    3456 ,High end model. Fully agent Borneo serviced and maintained. Ceramic paint protection done. Inspection/evaluation welcome too. Always sheltered parked. Accident free.
HONDA FREED HYBRID 1.5G AUTO                           , 129800 ,       17800 ,   41000 ,11-Nov-2020       ,     6.6 ,          1 , 29486 ,  23281 , 1010 ,    1496 ,"Sports rims, leather seats, DVD touch screen player, reverse camera and sensors, multi control steering, cruise control, retractable side mirrors."
MAZDA CX-3 1.5 AT ELEGANCE I3.5                        , 117800 ,       14847 ,   28000 ,06-Jul-2021       ,     7.3 ,          2 , 19196 ,  19196 ,  850 ,    1496 ,Auto LED headlamp with day running lights. Factory fitted audio with reverse camera and sensor. Multi control steering wheel. Auto rain sensor.
MERCEDES BENZ C200 AMG LINE M-HYBRID AUTO              , 213000 ,       22315 ,   59000 ,03-Jun-2022       ,     8.2 ,          1 , 48503 ,  59905 , 1650 ,    1496 ,"19"" multi spoke AMG rims, Leather seats; keyless entry; Push start/stop; infotainment system; multifunctional steering wheel; multi beam LED headlights"
MERCEDES BENZ B180 STYLE (R16 LED)                     ,  37888 ,       16694 ,  122126 ,27-Oct-2015       ,     1.6 ,          5 , 25384 ,  22538 ,  900 ,    1595 ,"Bluetooth, dual electric memory seats, auto headlamp/climatic aircon, reverse sensors/camera."
HYUNDAI AD AVANTE 1.6 GLS (A)                          ,  80800 ,       13892 ,   49000 ,01-Aug-2019       ,     5.4 ,          2 , 12631 ,  12631 ,  938 ,    1591 ,"Sports rims, leather seats, rear aircon, reverse camera, Bluetooth, Apple CarPlay/Android Auto, multi-function steering, foldable side mirrors."
MITSUBISHI OUTLANDER 2.0 CVT                           ,  92800 ,       17301 ,   85796 ,09-Jan-2019       ,     4.8 ,          2 , 19419 ,  19419 , 1100 ,    1998 ,"Multi-function steering wheel, leather seats, reverse camera, Kenwood infotainment system, retractable side mirrors, rear aircon and more!"
HONDA GRACE HYBRID 1.5DX AUTO                          ,  68900 ,       15656 ,   85000 ,18-Jun-2018       ,     4.2 ,          1 , 23112 ,   5000 , 1010 ,    1496 ,Keyless entry keyless start stop. Reverse camera. Sports rim.
NISSAN SYLPHY 1.6 CVT ABS D/AIRBAG 2WD 4DR             ,  33000 ,       14802 ,   78000 ,26-Nov-2015       ,     1.7 ,          1 , 16283 ,  16283 ,  850 ,    1598 ,"Sports rims, leather seats, rear aircon, touchscreen audio with Bluetooth, reverse camera/sensor, multi function steering, recording camera."
TOYOTA ALPHARD HYBRID 2.5SR-C CVT                      , 264000 ,       28441 ,  115000 ,29-Dec-2021       ,     7.8 ,          1 , 63263 ,  85874 , 1450 ,    2493 ,"Dual power sliding doors, power backdoor, keyless entry, twin Moonroof, ventilated seats, executive power seats, electric tailgate, auto aircon."
VOLKSWAGEN TIGUAN R-LINE 380 TSI                       ,  77000 ,       18393 ,  132952 ,31-Jan-2017       ,     2.9 ,          3 , 40631 ,  48884 , 1620 ,    1984 ,"Factory fitted Volkswagen infotainment system, Bluetooth connectivity, R-Line body kit, AP Racing brake kit, LED DRLs and more!"
TOYOTA ALLION 1.5 A                                    ,  60800 ,       11711 ,  186000 ,15-Jun-2009       ,     5.2 ,          3 , 18284 ,  18284 ,  810 ,    1496 ,"Leather seats, upgraded sports rims, Alpine touchscreen head unit, retractable side mirrors with indicators, reverse sensors, solar film."
ASTON MARTIN DB9 VOLANTE                               , 119000 ,       61349 ,   24000 ,01-Mar-2006       ,     1.9 ,          6 ,258920 , 284812 , 3360 ,    5935 ,"Electric seats with memory function, 2+2 seating configuration. Multi-function steering wheel."
MAZDA 3 4-DOOR SEDAN 1.5L SP.6EAT                      , 103800 ,      134453 ,  147000 ,24-Dec-2014       ,     0.8 ,          3 , 14206 ,   5000 ,  880 ,    1496 ,"Leather seats, sports rims, factory fitted audio, bluetooth, reverse sensors, auto side mirrors, Sunroof,multi function steering, rear knockdown seats."
HYUNDAI VELOSTER FS 1.6 DOHC ABS A/BAG AUTO            ,  68800 ,       78453 ,  123000 ,02-Jan-2015       ,     0.8 ,          3 , 15515 ,  15515 ,  970 ,    1591 ,"Electronic leather seats, upgraded sports rims, factory fitted audio player, reverse camera, retractable side mirrors, multi function steering."
MAZDA CX-3 2.0 AT STANDARD 2WD                         ,  79300 ,       13628 ,   75270 ,28-May-2019       ,     5.2 ,          2 , 17389 ,  17389 , 1150 ,    1998 ,"Factory fitted audio player, retractable side mirrors, multi function steering control, rain sensing, auto headlights."
HONDA SHUTTLE 1.5G CVT SENSING                         , 118800 ,       13659 ,   22000 ,08-Aug-2022       ,     8.4 ,          1 , 22609 ,   8653 ,  950 ,    1496 ,"Black leather upholstery. Bluetooth player. 16"" sports concave dish rims. Reverse camera, cruise control, cruise radar, lane keeping assistance."
AUDI A3 SEDAN 1.4 TFSI (ATTRACTION)                    ,  48800 ,       15498 ,  127000 ,28-Oct-2016       ,     2.6 ,          2 , 25068 ,  17096 ,  920 ,    1395 ,"Keyless, reverse sensors, drive select, Audi MMI, Bluetooth, auto Xenon headlamps, LED DRL, factory fitted Audi audio, paddle shifter."
VOLKSWAGEN SCIROCCO 1.4L AT TSI 1372Q5 HID             ,  78700 ,       10819 ,  120100 ,13-Jul-2011       ,     7.3 ,          5 , 26317 ,  26317 , 1180 ,    1390 ,"Original Calf Leather Upholstery, Original Color Paintwork, Upgraded Android Player, Reverse Cam, Brand New Batteries, Fully Stock Condition."
BMW 420I GRAN COUPE LED NAV                            , 144000 ,       21281 ,   50000 ,27-Aug-2019       ,     5.4 ,          2 , 46341 ,  56878 , 1350 ,    1998 ,"Auto Head Lights, Electric Folding Side Mirrors, Multi-function Steering Wheel, Keyless Entry and Keyless Engine Start, Driver's Electric Seat, Electric Tailgate"
BMW 325I AT 2.5L ABS D/AB HID 2WD 4DR                  ,  70000 ,       14394 ,  158000 ,28-Apr-2009       ,     4.9 ,          2 , 48331 ,  48331 , 1600 ,    2497 ,"Auto Head Lights, Electric Folding Side Mirrors, Multi-function Steering Wheel, Keyless Engine Start, Driver's Electric Seat"
TOYOTA NOAH HYBRID 1.8X CVT 2WD 7 SEATER               , 175800 ,       21164 ,   21000 ,11-Jan-2022       ,     7.8 ,          1 , 31576 ,  21207 , 1000 ,    1797 ,"Leather Seats, Sport Rims, Pioneer DVD Player With Bluetooth and Reverse Sensor, Keyless Entry, Solar Film, Reverse Sensor, F/Back Recorder."
MERCEDES BENZ CLA180 COUPE PROGRESSIVE                 , 178800 ,       19500 ,   11464 ,20-May-2022       ,     8.2 ,          1 , 33778 ,  39290 ,  960 ,    1332 ,"18"" sports rims, 10.25"" touchscreen instrument panel, ambient lighting. Bluetooth, cruise control, keyless entry/ start/ stop."
FERRARI F430 SPIDER A                                  , 298800 ,       42044 ,   55000 ,23-Jun-2011       ,     7.1 ,          6 ,219293 , 219293 , 3570 ,    4308 ,"Electric folding soft-top, yellow tachometer, carbon ceramic brakes."
FERRARI CALIFORNIA 4.3L A/T ABS D/AB 2WD 2DR HID       , 368800 ,       41229 ,   35000 ,02-Mar-2013       ,     8.9 ,          8 ,330157 , 330157 , 3600 ,    4297 ,"20"" forged rims, hard top convertible, dual electric seats, auto headlamp/climatic aircon, reverse sensors/camera, rotors & brakes replaced."
BMW 540I XDRIVE LED NAV HUD SR RCP MSPT                , 193800 ,       36762 ,   87606 ,06-Feb-2018       ,     3.9 ,          1 , 72648 , 102767 , 2500 ,    2998 ,"Heads up display, GPS, Bluetooth, surround cameras, soft close, connected drive, paddle shifters, Harmon Kardon, gesture control."
CITROEN C3 AIRCROSS FEEL 1.2 PURETECH 110 EAT6         ,  79800 ,       13840 ,   31000 ,29-May-2019       ,     5.2 ,          2 , 16124 ,  16124 ,  810 ,    1199 ,"Apple/Android CarpPlay, leather seats, 180/reverse camera, wireless charging, smart touch control panel, steering controls, in-car dashcam."
MERCEDES BENZ E300E AVANTGARDE FL                      , 236800 ,       23899 ,   19812 ,24-Aug-2022       ,     8.4 ,          1 , 63212 ,  70782 , 2450 ,    1991 ,"19"" sports rims, 10.25"" touchscreen infotainment with navigation, Android Auto/ Apple CarPlay, soft closing, 360 parking camera, collision assist."
BMW 216I GRAN TOURER                                   ,  97800 ,       17398 ,  102000 ,01-Nov-2018       ,     4.6 ,          1 , 30824 ,  35154 ,  800 ,    1499 ,"Original Factory Fitted 17 Inch Sports Rim, Black Color Premium Leather Seats With Electric, Keyless Entry, Knockdown Rear Seats, Electric Tailgate."
HONDA CIVIC 1.5 TURBO VTIS SR                          ,  60000 ,       18915 ,  115000 ,10-Oct-2016       ,     2.5 ,          1 , 26078 ,  23510 , 1270 ,    1498 ,"18"" Rays Forged Rims, Keyless Entry, Push Start/stop, Adaptive Cruise Control, Sunroof, Reverse Camera/sensors, Touch Screen Audio System, Rear AC."
KIA FORTE K3 1.6A                                      ,  49800 ,       15459 ,   90000 ,21-Dec-2016       ,     2.7 ,          1 , 14723 ,  14723 ,  953 ,    1591 ,"Leather/knockdown Seats, Retractable Side Mirror, Rear Aircon, Bluetooth, Reverse Sensor, Multi Function Steering Wheel, Front/rear Dashcam, 2 Keys."
LEXUS IS200T EXECUTIVE                                 ,  81800 ,       22154 ,   55000 ,29-Nov-2016       ,     2.7 ,          2 , 37509 ,  44513 , 1800 ,    1998 ,"Keyless Entry, Push Start/stop, Dual Climate Control, Ventilated Seats, Reverse Camera/sensors, Bluetooth, Navigation, Dual Electric Seats."
MINI COOPER CABRIO AT LED                              ,  85800 ,       21262 ,   63000 ,16-Aug-2017       ,     3.4 ,          1 , 28668 ,  27136 , 1000 ,    1499 ,"Keyless Entry/ Engine Start, Dual Zone Aircon Control, Cruise Control, Multi- Function Steering Wheel, Reverse Sensors With Guide, Front Fog Lights."
MINI ONE 5DR LED                                       ,  71800 ,       18089 ,   58000 ,17-Oct-2017       ,     3.6 ,          1 , 23251 ,  14552 ,  750 ,    1198 ,"Auto Headlights/wiper, Sport/green Mode, Keyless Start/Stop, Ambient Lighting, PDC Rear, Bluetooth, Cruise Control"
OPEL GRANDLAND X B12XHT AT                             , 105800 ,       13659 ,   55000 ,01-Oct-2020       ,     6.5 ,          2 , 29519 ,  33327 ,  960 ,    1199 ,"Sports Rims, Leather Ventilated Seats, 360 Degree View Camera, Park Assist, Blind Spot Indicator, Power Tailgate."
PEUGEOT 2008 ACTIVE PURETECH 1.2 EAT6 (FL) S/R         ,  68800 ,       15215 ,   54000 ,08-Jun-2018       ,     4.2 ,          1 , 19461 ,   9461 ,  810 ,    1199 ,"Apple Carplay/Android Auto, Bluetooth, Multi Zone Aircon, Reverse Camera, Panoramic Roof."
BENTLEY FLYING SPUR W12                                ,1084000 ,      134791 ,   40000 ,18-Sep-2020       ,     6.5 ,          2 ,247947 , 418305 , 4670 ,    5950 ,"Auto Head Lights, Multi-function Steering Wheel, Keyless Entry, Keyless Engine Start, Multi-zone Aircon, Sunroof"
TOYOTA WISH 1.8 CVT                                    ,  54800 ,       17516 ,   76800 ,14-Oct-2016       ,     2.6 ,          1 , 19955 ,  19955 , 1050 ,    1798 ,"Leather Seats, Audio Player, Reverse Camera, Retractable Side Mirrors, Solar Films."
BMW 316I 1.6 AT D/AB 4DR ABS HID                       ,  57800 ,       14074 ,  129000 ,02-May-2013       ,     4.1 ,          5 , 31902 ,  26663 , 1000 ,    1598 ,"Electric memories seats, BMW factory audio system, sports rims, iDrive with Bluetooth, keyless entry/start, multi function steering control."
VOLKSWAGEN GOLF 1.4 TSI CL                             , 100800 ,       14204 ,   50819 ,17-Aug-2020       ,     6.4 ,          2 , 19705 ,  19705 ,  920 ,    1395 ,"Sport rims, auto LED headlights, LED DRL, reverse camera, front and rear sensors, auto rain sensors, knockdown rear seats, fog lamp, rear aircon."
BMW 528I AT DSC HID NAV                                , 149800 ,      167582 ,  155957 ,19-Dec-2014       ,     0.7 ,          3 , 46193 ,  51671 , 1800 ,    1997 ,"Keyless entry/start, leather seats, reverse camera/sensors, power tailgate with kick boot, navigation, Bluetooth."
MAZDA 2 HATCHBACK 1.5 AT STANDARD 2WD                  ,  72800 ,       12708 ,   62634 ,22-May-2019       ,     5.2 ,          2 , 14272 ,  14272 ,  850 ,    1496 ,Factory Fitted Bluetooth Media System. Sports Rims. Leather Seats. USB Slot. Reverse Sensors. Electric Folding Mirrors.
KIA CERATO 1.6(A) EX                                   , 105800 ,       16392 ,   93000 ,23-Mar-2020       ,     6.0 ,          2 , 14902 ,  14902 ,  938 ,    1591 ,"Sports rims, leather seats, retracable side mirror/indicator, rear aircon, factory fitted audio, reverse senor/camera, bluetooth, rear knock down seat"
PORSCHE CAYENNE E-HYBRID COUPE                         , 520000 ,       49758 ,   10000 ,04-Nov-2022       ,     8.6 ,          1 ,109992 , 181983 , 3400 ,    2995 ,"Porsche PASM & PDLS, TPM, Sport Chrono Pack, Keyless Entyry/Start, Panoramic Glass Roof. AWD."
BMW X1 SDRIVE18I AT D/AB 2WD 5DR GAS/D SR              ,  93000 ,       14426 ,  156000 ,29-Sep-2010       ,     6.4 ,          6 , 28542 ,  28542 , 1100 ,    1995 ,"Sunroof, driver electric memory seat, sports rims, factory fitted audio/bt/rev camera/sensor, fog light, auto folding mirror, multi steering controls."
PORSCHE CAYMAN TIPTRONIC                               , 101888 ,       25560 ,  230000 ,18-Mar-2008       ,     4.0 ,          2 , 82514 ,  82514 , 1800 ,    2687 ,"19"" Porsche Sport Rims. All In Stock Condition. All Wear And Tear Repaired. Electric Memory Seat, In Car Recording Camera."
NISSAN X-TRAIL 2.0 CVT                                 ,  94000 ,       16410 ,   86000 ,26-Feb-2019       ,     4.9 ,          2 , 24391 ,  26148 , 1060 ,    1997 ,"Auto Head Lights, Electric Folding Side Mirrors, Multi-function Steering Wheel, Keyless Entry and Engine Start, Driver's Electric Seat, Electric Tailgate"
TOYOTA VELLFIRE 3.5Z G-EDITION A                       , 105800 ,       18584 ,  135000 ,21-May-2010       ,     5.7 ,          5 , 51560 ,  51560 , 2060 ,    3456 ,Electric function pilot seats. Twin Moonroof. Premium leather seats. Pioneer infotainment. Reverse camera & sensors. Electric tailgate. Rear aircons.
LEXUS UX200 5DR SUV (AT) (2WD) EXECUTIVE               , 169800 ,       19314 ,   27000 ,10-Dec-2021       ,     7.7 ,          1 , 35342 ,  41479 , 1270 ,    1987 ,"Keyless Entry/start, Lane Departure Alert, Factory Fitted Audio With Navigation, Reverse Camera, Multi Function Steering."
MITSUBISHI OUTLANDER 2.4 CVT AWD S/R FACELIFT          ,  45800 ,       17082 ,  119000 ,08-Apr-2016       ,     2.0 ,          2 , 21335 ,  21869 , 1230 ,    2360 ,7 Seaters SUV. Driver Electric Seats. Electric Parking Brake. Multi Zone Aircon. Leather Seats. Halogen Headlights. Paddle Shifters. Auto Fold Mirrors
PORSCHE PANAMERA                                       , 123800 ,       18970 ,  135898 ,18-Jan-2011       ,     6.5 ,          4 ,107606 , 107606 , 3000 ,    3605 ,"Electric park brake, multi function steering wheel, keyless entry/start, driver electric seat, knockdown rear seats, electric tailgate, cruise control"
VOLVO S60 T2 A/T                                       ,  59500 ,       14309 ,   96783 ,22-May-2017       ,     3.2 ,          4 , 26087 ,  28522 ,  900 ,    1498 ,"Electric/memory leather seats, sports rims, reverse sensors, Bluetooth, auto headlights, cruise control, paddle shifts, keyless entry/push start/stop."
FORD MUSTANG 2.3 GTDI AT                               , 163800 ,       55748 ,   77133 ,13-Sep-2016       ,     2.5 ,          1 , 42470 ,  51458 , 2332 ,    2261 ,Premium audio system. Keyless entry start/stop. Bi-xenon headlights and reverse camera. Original Sport Rims. Apple CarPlay.
BMW 520I LED NAV                                       , 108800 ,       22596 ,   91000 ,27-Sep-2017       ,     3.5 ,          1 , 47763 ,  58869 , 1350 ,    1998 ,"BMW touch command, gesture control, GPS, Bluetooth, connected drive, BMW advanced Careye dashcam front & back, gear shift paddles, 19 inch sport rims."
"MERCEDES BENZ AMG SL43 CONVERTIBLE RAS, DL"           , 748500 ,       67386 ,    1000 ,26-Apr-2023       ,     9.1 ,          1 ,150509 , 271120 , 2900 ,    1991 ,"AMG 20"" Wheels, AMG Steering Wheels, Burmester Surround Sound System, Elegant Signature Brown Leather Interior, Digital Display, Soft Top Cabriolet."
MERCEDES BENZ CLA200 AMG LINE (R18 BI)                 , 116688 ,       11669 ,  144000 ,28-Apr-2014       ,     0.1 ,          5 , 29920 ,  23888 , 1150 ,    1595 ,"OZ Racing 19"" Sports Rim, AMG Bodykit, AMG Calipers, Upgraded Android Player, Electronic Seats, Multifunction Steering Wheel, Reverse Camera/Sensors,"
KIA FORTE K3 1.6A                                      , 108688 ,       10869 ,   88000 ,11-Sep-2014       ,     0.5 ,          1 , 13689 ,   8689 ,  953 ,    1591 ,"Leather seats, sports rims, factory fitted audio system, auto retractable side mirror with signal indicator, reverse sensor."
BMW 216I ACTIVE TOURER MSPT ALED                       , 197200 ,       19070 ,    5000 ,21-Jul-2023       ,     9.3 ,          1 , 33206 ,  38489 ,  900 ,    1499 ,"Latest infotainment system, including a large touch screen display, apple car play, android auto, walk away auto door lock, auto tailgate."
HYUNDAI LM TUCSON 2.0L AUTO ABS D/AB SR                ,  79800 ,       13611 ,  116000 ,01-Feb-2010       ,     5.9 ,          5 , 20903 ,  20903 , 1220 ,    1998 ,"Android touch screen player, Brembo brake kit, reverse camera, in car camera. Dual Sunroof."
MERCEDES BENZ C 180                                    ,  91300 ,       12552 ,  130000 ,01-Aug-2011       ,     7.3 ,          2 , 38863 ,  38863 , 1150 ,    1796 ,"7 speed automatic gearbox, agent unit, brand new paintwork with coat, black interior leather."
HONDA JAZZ 1.5L A                                      ,  68800 ,       12450 ,   83000 ,23-Oct-2009       ,     5.5 ,          1 , 24443 ,  24443 ,  880 ,    1497 ,"Paddle shift, Panaromic roof view, Sport rim, New paintworks, Original conditions by Kah Motor."
ASTON MARTIN V8 VANTAGE COUPE SPORTSHIFT               , 215800 ,       53619 ,   39000 ,04-Apr-2008       ,     4.0 ,          2 ,195607 , 195607 , 2830 ,    4282 ,"New leather seats, Multi-function Steering Wheel, Cruise Control, Navigational Infotainment System"
BMW X1 SDRIVE18I LED NAV                               ,  93188 ,       17184 ,   70000 ,13-Jun-2018       ,     4.2 ,          2 , 35132 ,  41185 , 1030 ,    1499 ,"BMW iDrive unit, sports rims, reverse camera/sensors, dual electric seats, auto tailgate, multi function steering wheel."
BMW 216D GRAN TOURER LED NAV 7 SEATER                  ,  68688 ,       17064 ,  103000 ,28-Jun-2017       ,     3.3 ,          1 , 31438 ,  26014 ,  850 ,    1496 ,"Factory fitted audio system, reverse camera/sensors, auto tailgate, auto headlight, electric seats, rear aircon, knockdown rear seats."
BMW 220I COUPE SR HID NAV M SPORT                      , 137688 ,       13769 ,  108000 ,24-Sep-2014       ,     0.5 ,          3 , 37343 ,  34281 , 1350 ,    1997 ,"Factory fitted audio system, Sunroof, multifunction steering wheel, sports rim, reverse sensors, auto headlight, electric seats."
BMW 420I COUPE LED SR NAV MSPT                         , 118688 ,       20076 ,   94000 ,21-Sep-2018       ,     4.5 ,          1 , 46167 ,  56634 , 1350 ,    1998 ,"BMW iDrive, M-Sport rims, Sunroof, reverse camera/sensors, LED headlight/DRL, electric seats, multi function steering wheel."
BMW 520I AT D/AB 2WD 4DR LED NAV                       ,  48688 ,       22052 ,  116000 ,08-May-2015       ,     1.1 ,          2 , 43453 ,  47835 , 1350 ,    1997 ,"Multi function steering wheel, sports rims, auto LED headlight, keyless entry/start/stop, reverse sensors."
HONDA ODYSSEY 2.4 A                                    ,  55388 ,       19859 ,  137000 ,06-Jan-2007       ,     2.8 ,          1 , 28619 ,  31481 , 1180 ,    2354 ,"Factory fitted audio system, Sunroof, multi function steering wheel, reverse sensors, front and rear disc brake."
HONDA SHUTTLE 1.5G CVT SENSING                         ,  95688 ,       13471 ,   28000 ,18-Dec-2020       ,     6.7 ,          2 , 19796 ,   9796 ,  950 ,    1496 ,"Android player, sports rims, knockdown rears seats, 360 camera, eco mode."
KIA SPORTAGE 2.0(A) FWD                                ,  65988 ,       15721 ,   89000 ,18-Aug-2017       ,     3.4 ,          1 , 23561 ,  24986 , 1140 ,    1999 ,"Bi-Xenon headlamps, sports rims, multifunction steering wheel, reverse camera/sensors, knockdown rear seats."
MERCEDES BENZ C180 AVANTGARDE (R17 LED)                , 106588 ,       19902 ,   83000 ,18-Jun-2018       ,     4.2 ,          1 , 37480 ,  44472 , 1150 ,    1595 ,"Electric memory seats, keyless entry/start, collision prevention assist, reverse camera/sensors."
MERCEDES BENZ C180 AVANTGARDE (R17 LED)                ,  66500 ,       20229 ,  103000 ,19-Aug-2016       ,     2.4 ,          3 , 34691 ,  35568 , 1150 ,    1595 ,"Electric tailgate, multi function steering, factory fitted audio system, reverse camera/sensors, electric seats, rain sensors, auto headlight."
MERCEDES BENZ E200 A/T ABS AIRBAGS 2WD SOFTOP          , 159888 ,       15989 ,   72000 ,29-Apr-2014       ,     0.1 ,          1 , 51211 ,  59180 , 1350 ,    1991 ,"Multi function steering wheel, AMG rims, electric memory seats, Bluetooth, paddle shifters, auto fold side mirrors."
MERCEDES BENZ SLK200 ROADSTER (W/O SR)                 , 154687 ,       15469 ,   77000 ,15-Apr-2014       ,     0.1 ,          1 , 53408 ,  63135 , 1350 ,    1796 ,"Factory fitted audio system, reverse sensors, electric memory seats."
MITSUBISHI ATTRAGE 1.2 CVT                             ,  34388 ,       13152 ,   78000 ,26-Aug-2016       ,     2.4 ,          1 , 14471 ,   5000 ,  570 ,    1193 ,"Multi function steering wheel, factory fitted audio system, leather seats, reverse sensors."
BMW 320I LED HL                                        , 163000 ,       20794 ,   41000 ,11-Sep-2020       ,     6.5 ,          3 , 46340 ,  56876 , 1350 ,    1998 ,"Auto Head Lights, Multi-function Steering Wheel, Keyless Entry and Engine Start, Driver's Electric Seat, Electric Tailgate"
TOYOTA VELLFIRE 7-SEATER 2.5Z CVT                      , 179000 ,       28104 ,   65000 ,30-Aug-2019       ,     5.4 ,          1 , 42973 ,  52163 , 1340 ,    2493 ,"Sports rims, leather seats,audio system, pre-collision system, lane departure alert, moonroof, dual power sliding doors."
MITSUBISHI LANCER EX 1.6 AT LED TAIL LAMP              ,  49273 ,       13824 ,  105000 ,25-Apr-2017       ,     3.1 ,          3 , 13181 ,  13181 ,  860 ,    1590 ,-
BMW 216I GT LED NAV                                    ,  77800 ,       16156 ,  128808 ,13-Dec-2017       ,     3.7 ,          1 , 30858 ,  35202 ,  750 ,    1499 ,"Factory Fitted Audio System With BT/nav, Keyless Entry/start/stop, Electric Memory Seat, Sports Rims, Reverse Sensors/camera, and Auto LED Headlights."
MERCEDES BENZ E 200CGI                                 ,  71000 ,       12654 ,  153000 ,28-Dec-2009       ,     5.6 ,          5 , 51191 ,  51191 , 1350 ,    1796 ,"Auto Head Lights, Electric Folding Side Mirrors, Multi-function Steering Wheel, Keyless Entry, Driver's Electric Seat"
