model                                                  ,price   ,depreciation ,milleage ,registration_date ,coe_left ,no_of_owner ,omv    ,arf     ,power ,capacity ,accessories
MITSUBISHI LANCER EX 1.6 AT LED TAIL LAMP              ,  37888 ,       14768 ,   80639 ,28-Apr-2016       ,     2.1 ,          1 , 13791 ,  13791 ,  860 ,    1590 ,"Sports rims, leather seats, factory fitted audio system with BT connect, reverse camera & sensors, auto headlight, LED DRL, fog lamps, keyless go."
MAZDA 2 HATCHBACK 1.5 AT STANDARD 2WD                  ,  72888 ,       13748 ,   32100 ,31-Dec-2018       ,     4.8 ,          1 , 14469 ,  14469 ,  850 ,    1496 ,"Factory audio system, leather seats, reverse sensors, rear knock down seats, retractable side mirrors, multi function steering."
AUDI Q3 SB 1.5 TFSI S TRONIC (LED REAR)                , 217888 ,       23158 ,    8000 ,28-Oct-2022       ,     8.6 ,          2 , 32374 ,  37324 , 1100 ,    1498 ,Full RS-Sports Body. Audi Virtual Cockpit. MMI Navi with MMI Touch. Ambient Lights. Paddle Shifts. Reverse Sensors w 360 Camera. Apple Car/Android. Fu
VOLKSWAGEN TIGUAN 2.0 ELEGANCE SR                      , 197888 ,       21193 ,    2800 ,29-Sep-2022       ,     8.5 ,          1 , 30359 ,  34503 , 1400 ,    1984 ,"Panoramic Roof, LED Plus Headlights, Factory Fitted Player With Apple Car Play, Smartphone Connect, Keyless Entry/Start/Stop, 360 View Camera."
HONDA VEZEL 1.5X CVT                                   ,  63800 ,       14718 ,   60000 ,28-Feb-2018       ,     3.9 ,          2 , 21281 ,  11794 ,  960 ,    1496 ,"Leather seats, sport rims, Pioneer audio system, reverse camera and sensors, multi function steering control."
KIA FORTE K3 1.6A                                      ,  53800 ,       13794 ,   98000 ,13-Sep-2017       ,     3.5 ,          2 , 11762 ,  11762 ,  953 ,    1591 ,"Leather seats, Sports rims, Pioneer Bluetooth head-unit, Reverse sensors, Reverse camera, Knockdown seats, Front/rear camera."
HYUNDAI ELANTRA 1.6 AT ABS D/AB 2WD 4DR                ,  52800 ,       12346 ,  120000 ,24-Jul-2013       ,     4.3 ,          3 , 11608 ,   6608 ,  956 ,    1591 ,"Leather seats, sport rims, DVD Android player, knockdown rear seats, auto fold side mirror."
HONDA FREED 1.5L E AT                                  ,  72800 ,       12787 ,  160000 ,12-Dec-2009       ,     5.7 ,          4 , 26068 ,  26068 ,  870 ,    1497 ,"Sliding doors, leather seats, sports rims, knockdown rear seats, electric folding side mirrors, Pioneer bt head-unit, reverse sensor and camera."
VOLKSWAGEN NEW BEETLE 1.6 A 6SPD                       ,  63800 ,       10741 ,  112600 ,04-Mar-2010       ,     5.9 ,          4 , 17802 ,  17802 ,  750 ,    1595 ,"Factory fitted radio, leather seats and fully stock condition. Door step viewing available!"
TOYOTA C-HR HYBRID 1.8S CVT                            ,  93800 ,       17057 ,   50000 ,15-Jan-2019       ,     4.8 ,          1 , 29496 ,  23295 ,  900 ,    1797 ,"Keyless Entry/start,leather Seats, Upgraded Touchscreen Head Unit, Reverse Cam/sensor, In Car Recorder, Toyota Safety Sense."
HYUNDAI ACCENT (RB) 1.4 CVT                            ,  71888 ,       12361 ,   47150 ,03-Sep-2019       ,     5.4 ,          2 ,  9055 ,   9055 ,  736 ,    1368 ,"Leather seats, reverse camera, factory fitted audio with Bluetooth, sensors, multi function steering control."
RENAULT GRAND SCENIC IV 1.5 DCI AT EU6                 ,  95800 ,       16250 ,   46188 ,30-Jul-2019       ,     5.4 ,          1 , 25440 ,  17616 ,  810 ,    1461 ,Monroof. Keyless Entry & Start/ Stop. Multi Function Steering Wheel. Blind Spot Assist. Rain Sensor. Rear Aircon.
TOYOTA NOAH HYBRID 1.8X CVT                            , 155800 ,       22418 ,   55000 ,30-Jun-2020       ,     6.3 ,          2 , 34498 ,  30298 , 1000 ,    1797 ,"Original factory fitted sports rims, leather seats, touch screen DVD player, reverse sensors/camera, retractable side mirrors, rear aircon, solar film"
HONDA VEZEL 1.5G CVT                                   , 139800 ,       14426 ,      80 ,27-Sep-2023       ,     9.5 ,          1 , 18038 ,   5000 ,  870 ,    1496 ,-
HONDA VEZEL 1.5G CVT                                   , 139800 ,       14274 ,      80 ,03-Nov-2023       ,     9.6 ,          1 , 18227 ,   5000 ,  870 ,    1496 ,"Multi-Media
                                                                                                                                                                     Leather Upholstery
                                                                                                                                                                     Solar Firm
                                                                                                                                                                     Dash-Cam
                                                                                                                                                                     Sport Rim"
TOYOTA NOAH HYBRID 1.8X CVT                            , 195800 ,       19613 ,      80 ,21-Nov-2023       ,     9.7 ,          1 , 25251 ,  12352 , 1030 ,    1797 ,-
MERCEDES BENZ GLC300 PREMIUM AMG LINE M-HYBRID         , 335800 ,       30904 ,      80 ,28-Aug-2023       ,     9.4 ,          1 , 60964 ,  88410 , 2070 ,    1999 ,-
TOYOTA ALPHARD HYBRID 2.5Z                             , 358800 ,       33924 ,      80 ,28-Dec-2023       ,     9.8 ,          1 , 51435 ,  54727 , 1840 ,    2487 ,-
VOLKSWAGEN SHARAN 2.0 TSI 7N24MY                       , 104888 ,       19915 ,   66200 ,20-Jun-2018       ,     4.2 ,          2 , 34819 ,  40747 , 1620 ,    1984 ,"In built child booster seats, surround aircon, 19"" rims, electric tailgate, twins powered sliding door, reverse camera with surround parking assist."
HONDA CIVIC 1.6 VTI CVT                                ,  88800 ,       15094 ,   75343 ,11-Jun-2019       ,     5.2 ,          1 , 20031 ,  20044 ,  920 ,    1597 ,Fuel Consumption 14.9 km/L
TOYOTA RAIZE 1.0 XS CVT                                ,  99800 ,       13090 ,   28122 ,27-Aug-2021       ,     7.4 ,          1 , 18398 ,   5000 ,  720 ,     996 ,-
TOYOTA VOXY HYBRID 1.8SZ CVT                           , 212800 ,       20781 ,      80 ,28-Dec-2023       ,     9.8 ,          1 , 30305 ,  19427 , 1030 ,    1797 ,"+ Projector-type LED headlamp
                                                                                                                                                                     + with auto leveling function
                                                                                                                                                                     + 360 cam
                                                                                                                                                                     + Parking Support
                                                                                                                                                                     + middle row leg rest, ottoman seats
                                                                                                                                                                     + Auto tailgate
                                                                                                                                                                     + Side-Kick - Sliding door
                                                                                                                                                                     + Park Assist"
VOLKSWAGEN NEW BEETLE 1.6 A 6SPD                       ,  57800 ,       10460 ,  149404 ,14-Jan-2010       ,     5.5 ,          5 , 17837 ,  17837 ,  750 ,    1595 ,"Original Premium Leather Seats, Audio System, Reverse Sensors, Auto Climate Control"
BMW X3 SDRIVE20I                                       , 128800 ,       24356 ,   76171 ,26-Jun-2018       ,     4.3 ,          2 , 41483 ,  50077 , 1350 ,    1998 ,"Sports rim, leather seat, touch screen audio system, auto tailgate, GPS, electric seats, electric folding mirror/indicator, bluetooth, driving mode"
KIA CERATO 1.6(A) SUNROOF                              , 110800 ,       14328 ,   29763 ,27-Apr-2021       ,     7.1 ,          1 , 18179 ,  18179 ,  938 ,    1591 ,"Sunroof, GT line bodykit, 17"" rims, GT line sports ventilated seats, 8"" touchscreen w/ carplay and Android Auto, wireless charger. In-car camera."
HYUNDAI LF SONATA 2.0 GLS A/T                          ,  72800 ,       16933 ,   50001 ,27-Dec-2017       ,     3.8 ,          2 , 18206 ,  18206 , 1120 ,    1999 ,Daytime running lights. Electric fold side mirrors. Multi-function steering wheel. Electric seats. Multi-zone and rear aircon.
TOYOTA RAIZE HYBRID 1.2G CVT                           , 152800 ,       15480 ,      80 ,06-Dec-2023       ,     9.7 ,          1 , 19779 ,   5000 , 1380 ,    1196 ,-
HONDA HRV 1.5 LX CVT ABS D/AIRBAG 2WD                  ,  39800 ,       16143 ,   68000 ,09-Dec-2015       ,     1.7 ,          1 , 23082 ,  24315 ,  880 ,    1497 ,"Leather seats, sport rims, built-in audio system with Bluetooth, solar film, reverse sensor with rear camera."
LEXUS IS300H LUXURY CVT                                , 141800 ,       14180 ,   98000 ,21-Jul-2014       ,     0.3 ,          2 , 56821 ,  59278 , 1640 ,    2494 ,"Electronic leather seats, sports rims, Lexus premium audio system, GPS, reverse cam, ventilated seats, headlight washer, keyless entry/start/stop."
SUBARU FORESTER 2.0I-L CVT AWD SR                      ,  73800 ,       15721 ,   75000 ,26-Jun-2018       ,     4.3 ,          2 , 13559 ,  13559 , 1100 ,    1995 ,"Panoramic Roof, Electric Seats, X-Mode AWD, Paddle Shifters, Touch Screen Head Unit With Bluetooth, Lane keep assist."
MERCEDES BENZ C180 AVANTGARDE PA BSA                   , 226800 ,       23295 ,    2500 ,16-Dec-2022       ,     8.7 ,          1 , 38956 ,  46539 , 1400 ,    1496 ,"Fully Digital 12.3"" Instrument Cluster Display And 11.9"" MBUX Touchscreen Infotainment. Wireless Smartphone Charging. Wireless Apple CarPlay & Android Auto."
TOYOTA PRIUS HYBRID 1.8S CVT                           , 136800 ,       16915 ,   29986 ,14-Oct-2021       ,     7.6 ,          1 , 29070 ,  17698 ,  900 ,    1797 ,Keyless start/stop/entry. Premium leather seats. Reverse camera/sensors. Multi function steering wheel. Cruise control. Recording camera.
TOYOTA HARRIER ELEGANCE 2.0 A                          ,  80800 ,       19208 ,  111000 ,14-Aug-2017       ,     3.4 ,          2 , 31642 ,  31299 , 1110 ,    1986 ,"Dual climatic aircon controls, electric seats, knockdown rear seats, Panoramic Sunroof, Upgraded Head Unit With CarPlay/Android Auto."
PORSCHE CAYENNE S                                      , 378888 ,       45095 ,   72133 ,24-Jun-2020       ,     6.3 ,          2 ,123144 , 193660 , 3240 ,    2894 ,"Factory fitted 12.3-inch touchscreen infotainment with Apple CarPlay/Android Auto, Premium sound system, Front and rear climate controls and more!"
TOYOTA C-HR HYBRID 1.8S CVT                            ,  93800 ,       16629 ,   60000 ,13-Mar-2019       ,     5.0 ,          1 , 28732 ,  22225 ,  900 ,    1797 ,Multi function steering wheel. Toyota sensing. Leather seats. Auto folding mirrors. Reverse camera. Sports rims.
TOYOTA CAMRY HYBRID 4DR SEDAN (AT) STANDARD            , 153800 ,       18802 ,   30000 ,30-Nov-2021       ,     7.7 ,          1 , 29509 ,  18313 , 1550 ,    2487 ,"7"" touchscreen audio system, Bluetooth, smartphone connection system, multi function steering wheel, wireless charging, auto high beam."
MERCEDES BENZ A200 SPORT PREMIUM+ HATCHBACK            , 195800 ,       21948 ,   68000 ,13-Apr-2022       ,     8.1 ,          1 , 32617 ,  37664 , 1200 ,    1333 ,"Special Option, Highest Premium Plus Spec With Sunroof, Custom Forged 19 LFI Rims, AP BBK, Full Set Enzo Car Mats, Forged Carbon Steering, CF Panels"
HONDA ODYSSEY E:HEV ABSOLUTE 7 SEATER CVT              , 220800 ,       23437 ,   37000 ,21-Oct-2022       ,     8.6 ,          1 , 44372 ,  39121 , 2420 ,    1993 ,"Roof mount 10"" TV! Apple CarPlay/Android Auto, 360 view camera, dual side electric/gesture control power sliding door, auto LED headlights with DRL."
VOLVO XC60 T5 MOMENTUM                                 , 129888 ,       26182 ,   57043 ,26-Apr-2018       ,     4.1 ,          3 , 38070 ,  45298 , 1870 ,    1969 ,"20"" rims, Apple/Android Auto, LED auto headlight/wiper, rear side aircon, 12.3"" adaptive digital display, power tailgate, Sensus navigation."
OPEL ASTRA HB                                          , 110888 ,       15829 ,   60999 ,22-Oct-2020       ,     6.6 ,          1 , 22396 ,  13355 , 1070 ,    1341 ,"Multizone aircon, Android head unit, electric park brake, premium leather seats, rain sensing wipers, multi function steering wheel, bsm."
FERRARI PORTOFINO M                                    ,1180000 ,      102285 ,      20 ,17-Mar-2023       ,     9.0 ,          1 ,264398 , 521676 , 4560 ,    3855 ,"Full electric seats, passenger display, front and rear parking sensors, parking camera, tpms, navigation and etc."
TOYOTA HARRIER HYBRID 2.5G CVT                         , 178888 ,       21316 ,   47000 ,27-Sep-2021       ,     7.5 ,          1 , 43053 ,  37275 , 1600 ,    2487 ,"Electric Seat, Reverse Camera/Sensors, Multi-Function Steering Wheel, Rear Aircon, Electric Parking Brake, Keyless Start/Stop."
MINI COOPER HATCHBACK 3DR LED DSC                      ,  52888 ,       19716 ,  111000 ,22-Jul-2016       ,     2.3 ,          3 , 22821 ,  13950 , 1000 ,    1499 ,"Original factory audio system, leather seats and knockdown rear seats. Foglights, multi function steering wheel, reverse sensors."
HONDA FIT BASIC 1.3 CVT                                , 101888 ,       13158 ,   28000 ,11-Oct-2021       ,     7.6 ,          1 , 15846 ,   5000 ,  720 ,    1317 ,Pioneer head unit with Bluetooth reverse camera. Original condition fabric seat and wheel cap.
VOLVO V40 T4 M                                         , 102888 ,       16720 ,   70000 ,30-Aug-2019       ,     5.4 ,          1 , 22799 ,  23919 , 1400 ,    1969 ,"Original rims, front, rear and reverse camera, Bluetooth, digital speedometer, 3 memory settings for driver, electric seat. Original stock condition."
LEXUS NX300 5DR SUV (AT) (4WD) LUXURY MR               , 164888 ,       24958 ,   41000 ,30-Aug-2019       ,     5.4 ,          2 , 47368 ,  58316 , 1750 ,    1998 ,"Smooth leather seats with memory, 60/40 power folding rear seats, blind spot assist, 360 cam, premium audio system, matrix LED headlights, Moonroof."
PEUGEOT 2008 1.2 EAT8 GT                               , 145888 ,       15485 ,   13000 ,18-Oct-2022       ,     8.6 ,          1 , 24422 ,  26191 ,  960 ,    1199 ,3D I-cockpit. Lane Departure Warning/warning Collision Assist. Walk Away Lock Feature. Wireless Phone Charging. Sunroof. LED Lights And DRL.
HONDA CIVIC 1.5 TURBO VTI CVT                          , 151887 ,       16622 ,   26166 ,06-Jul-2022       ,     8.3 ,          1 , 25832 ,  28165 ,  950 ,    1498 ,"Sports rims, leather upholstery, Android carPlay with Bluetooth and wireless charging, reverse camera/sensors and LED lights."
MITSUBISHI ATTRAGE 1.2 CVT                             ,  54888 ,       12305 ,   51000 ,25-Jun-2018       ,     4.3 ,          2 , 13488 ,   5000 ,  590 ,    1193 ,"Sports rims, leather seats, retractable side mirrors, auto climatic aircon, fog lamp, reverse camera/sensors."
SUBARU XV 2.0I-S EYESIGHT AWD CVT                      , 110888 ,       15389 ,   39000 ,19-Nov-2020       ,     6.7 ,          1 , 16788 ,  16788 , 1150 ,    1995 ,"Android head unit, navigation, 360 camera, retractable side mirrors, reverse sensor, auto tailgate, electric seats, body kit."
CITROEN C5 AIRCROSS 1.6L SHINE                         , 103888 ,       15854 ,   65000 ,13-Dec-2019       ,     5.7 ,          2 , 24377 ,  26128 , 1330 ,    1598 ,"Electric seat, electric power tailgate, blind spot monitoring system, Apple CarPlay/Android Auto, leather seat"
CITROEN C4 1.2 PURETECH EAT6                           ,  53888 ,       14162 ,   94000 ,08-Sep-2017       ,     3.5 ,          2 , 19767 ,   9767 ,  960 ,    1199 ,"Factory fitted audio and navigation systems, auto headlight and wipers, LED day running lights, factory fitted reverse camera and sensors."
BMW Z4 3.0 SDRIVE35I A                                 , 106888 ,       15892 ,  119000 ,13-Dec-2010       ,     6.7 ,          5 , 56544 ,  56544 , 2250 ,    2979 ,"Multi function steering wheel, paddle shifters, electric memory leather seats, retractable side mirrors, dynamic drive control, Bluetooth, navigation."
HONDA JAZZ 1.5 H-LUXE ECVT                             , 125500 ,       15408 ,   18333 ,20-Jan-2022       ,     7.8 ,          2 , 23367 ,   9714 ,  927 ,    1498 ,"Walk away lock, Factory fitted audio system with steering controls, Bluetooth, reverse camera, 9"" infotainment system w/ Apple CarPlay/Android Auto."
BMW 335I COUPE SMT HID ABS D/AB 2WD 2DR SR             , 121288 ,       16390 ,  170000 ,16-Aug-2011       ,     7.4 ,          4 , 55106 ,  55106 , 2250 ,    2979 ,-
BMW M3 4.0 A                                           , 142800 ,       23176 ,  110000 ,20-May-2010       ,     6.2 ,          7 , 78133 ,  78133 , 3090 ,    3999 ,"LTA-approved Akrapovic exhaust, Vorsteiner rims, Alcon brake kit, Gruppe M carbon intake, reverse camera, and fully functional upgraded steering wheel"
MERCEDES BENZ G350 BLUETEC 3.0 A                       , 385800 ,       41625 ,  103000 ,28-Jun-2013       ,     9.3 ,          4 , 85051 , 125092 , 1550 ,    2987 ,"Harmon Kardon sound system, black leather interior, 3 100% differential locks, Bluetooth audio. Full tank range close to 900km!"
MERCEDES BENZ A180 (R17)                               , 108800 ,       10880 ,  141000 ,18-Nov-2014       ,     0.7 ,          3 , 22897 ,  14056 ,  900 ,    1595 ,Factory Fitted Audio System. Multi Function Steering Control. Reverse Sensors/camera. Electronic Driver Seat With Lumbar Support. Rear Knockdown Seats
MERCEDES BENZ S320L (R19 LED)                          , 131800 ,       26565 ,  151000 ,01-Sep-2016       ,     2.4 ,          1 , 89948 , 133907 , 2000 ,    2996 ,"Factory Fitted Audio System With Bluetooth, Navigation. Reverse Sensors/camera. Electric Tailgate. Electronic Seats. Multi Function Steering Control."
KIA CARENS 1.7 DCT DIESEL 5DR FWD                      ,  74800 ,       14695 ,  120000 ,12-Jul-2018       ,     4.3 ,          2 , 22216 ,  23103 , 1040 ,    1685 ,Sports Rims. Sony Audio System With Bluetooth. Reverse Sensors/camera. Auto Headlights. Multi Function Steering Control. Active Eco Mode.
TOYOTA VELLFIRE 2.5 CVT S/R                            , 133800 ,       32457 ,  113000 ,29-Jun-2017       ,     3.3 ,          1 , 45431 ,  55604 , 1340 ,    2494 ,Premium Leather Seats. Factory Fitted Audio System With Bluetooth. Reverse Sensors/camera. Dual Auto Sliding Doors. Auto Tailgate. Electronic Seats.
MAZDA 6 4-DOOR SEDAN 2.0L SP.6EAT                      ,  67800 ,       13560 ,  146000 ,15-Jul-2014       ,     0.3 ,          3 , 20192 ,  10269 , 1140 ,    1998 ,Sport Rims. Touchscreen Audio System With Bluetooth. Reverse Sensors. Multi Function Steering Control. Retractable Side Mirrors. Electronic Seats.
MERCEDES BENZ SL 350                                   , 206800 ,       23384 ,   65000 ,24-Jan-2013       ,     8.8 ,          3 ,119058 , 119058 , 2250 ,    3498 ,"Multi-function steering wheel, electric memory seats, Bluetooth audio, reverse camera, full red leather interior, original paintwork. C&C unit."
KIA CERATO FORTE KOUP 1.6 AT SX ABS D/AB SR            ,  20608 ,       14410 ,  160000 ,27-Aug-2010       ,     1.4 ,          6 , 15116 ,  15116 ,  927 ,    1591 ,-
MERCEDES BENZ E200 SPORT M-HYBRID                      , 205800 ,       23539 ,   71000 ,17-Sep-2021       ,     7.5 ,          1 , 47835 ,  58969 , 1550 ,    1991 ,"18"" sports rims, multi function steering wheel, 12.3"" display with Apple CarPlay/Android Auto."
VOLKSWAGEN GOLF A7 1.4 TSI AT 5G13GZ W/O HID           ,  28800 ,       14469 ,   67666 ,25-Nov-2015       ,     1.7 ,          2 , 19158 ,   9158 ,  900 ,    1395 ,"Leather and electric seats, touchscreen infotainment system with 10inch android head unit and more!"
HONDA VEZEL HYBRID E:HEV 1.5X CVT                      , 146800 ,       18325 ,    1000 ,02-Nov-2021       ,     7.6 ,          1 , 26751 ,  14452 , 1740 ,    1496 ,"Sport rims. Factory fitted head unit with Bluetooth. Multi function steering wheel, leather seats."
SUBARU FORESTER 2.0I-L CVT AWD SR                      ,  75800 ,       15611 ,  105067 ,24-Aug-2018       ,     4.4 ,          2 , 13451 ,  13451 , 1100 ,    1995 ,"Sport Rims, Dual front electric seats, auto headlights, keyless entry/start, reverse camera and sensors, retractable side mirrors, sunroof."
MINI JOHN COOPER WORKS GP AUTO                         , 189500 ,       22160 ,   27000 ,08-Jun-2021       ,     7.2 ,          1 , 48059 ,  59283 , 2250 ,    1998 ,"OJCW GP sport bucket seat with dynamical/leather and red belts, 18"" GP rims, 3d printed fascia panel, 6.5"" startup screen, 8.8"" display, Apple CarPlay"
HONDA FIT 1.3GF CVT                                    ,  96500 ,       12972 ,   26000 ,21-Jun-2021       ,     7.2 ,          2 , 16148 ,   5000 ,  730 ,    1317 ,"Pioneer head unit with Bluetooth, reverse camera/sensors, leather seat, keyless start/stop/entry."
SEAT LEON SP FR 1.5 ETSI                               , 144800 ,       16769 ,   27696 ,27-Jun-2022       ,     8.3 ,          1 , 25274 ,  12384 , 1100 ,    1498 ,"LED headlights & taillights, keyless entry / push start, power-adjustable seats, rearview camera, sports rim and more!"
TOYOTA SIENTA STANDARD (AUTO)                          ,  82800 ,       15879 ,   77000 ,16-Nov-2018       ,     4.6 ,          2 , 17777 ,  17777 ,  790 ,    1496 ,"Leather seats, sports rims, reverse camera and sensors, knockdown rear seats, solar film."
BMW 116D 5DR LED EU6                                   ,  88500 ,       17533 ,   66000 ,16-May-2018       ,     4.1 ,          3 , 28248 ,  31548 ,  850 ,    1496 ,"BMW sports rims, front electric leather seats, factory fitted audio system with Bluetooth, steering wheel controls, reverse camera/sensor."
MERCEDES BENZ C 180 BLUEEFFICIENCY                     , 116800 ,       13356 ,  171000 ,18-Dec-2012       ,     8.7 ,          2 , 30160 ,  30160 , 1150 ,    1595 ,"Factory fitted Audio/CD system, Reverse Sensors, 17"" original Sports rims, Black leather seats, Tinted Films, Auto Headlamps/ Fog Lamps."
MERCEDES BENZ CLA180 (R18 BI)                          ,  33000 ,       34082 ,  160000 ,24-Nov-2014       ,     0.7 ,          2 , 27318 ,  20246 ,  900 ,    1595 ,"Dual electric memory seats, MB audio, reversecams, DRL, Bluetooth, sport rims, retractableside mirrors."
MERCEDES BENZ CLA45 AMG 4MATICS SB AUTO                , 158800 ,       28801 ,   62000 ,04-Jun-2018       ,     4.2 ,          2 , 57593 ,  75668 , 2800 ,    1991 ,Full AMG package. AMG performance exhaust and AMG bucket seats.
PORSCHE MACAN S 3.0 A/T ABS D/AIRBAG 4WD               , 101444 ,       55888 ,  155000 ,05-Mar-2015       ,     0.9 ,          3 , 69236 ,  96625 , 2500 ,    2997 ,-
MERCEDES BENZ GLB200 SPORT AUTO                        , 196800 ,       23689 ,   38158 ,26-Aug-2021       ,     7.4 ,          1 , 35410 ,  41574 , 1200 ,    1332 ,"18""Sport rims/pirelli tyres, Leather seats, auto tailgate, bluetooth, driving mode, electric folding side mirror/indicator, reverse camera/sensor"
SEAT ARONA STYLE 1.0 TSI 116 7AT                       ,  85300 ,       12751 ,   66000 ,28-Jul-2020       ,     6.3 ,          1 , 18647 ,   8647 ,  850 ,     999 ,"Sports rims, factory 8"" infotainment system, Bluetooth, media/USB/Android/Apple CarPlay, reverse camera, roof racks, LED DRL, fog lamps."
JAGUAR F-PACE R-SPORT 3.0 V6 SC SR                     , 152000 ,       28637 ,   74096 ,19-Dec-2017       ,     3.7 ,          4 , 65452 ,  89814 , 2500 ,    2995 ,"Factory fitted Jaguar InControl Touch Pro infotainment system, Bluetooth connectivity, Digital instrument cluster, Automatic LED DRLs and more!"
HONDA VEZEL 1.5X CVT                                   , 100300 ,       13803 ,   54452 ,08-Feb-2021       ,     6.9 ,          2 , 24012 ,  10617 ,  960 ,    1496 ,"Factory fitted audio system with Bluetooth connectivity, Upgraded Pioneer head unit, Knockdown rear seats and more!"
PEUGEOT 2008 ACTIVE PURETECH 1.2 EAT6 (FL) S/R         ,  49800 ,       15181 ,  101200 ,03-Apr-2017       ,     3.0 ,          1 , 17683 ,   7683 ,  810 ,    1199 ,"In built infotainment, Bluetooth, glass roof, leather seats, reverse camera/sensor."
MITSUBISHI LANCER 1.6 M                                ,  47800 ,       10843 ,  254000 ,19-Aug-2008       ,     4.4 ,          5 , 11330 ,  11330 ,  790 ,    1584 ,"Gen2 DR exhaust full system w/ cert, racing clutch, EVO3 brake kit, aluminium radiator, open pod air intake, tein coil over, Defi gauges, Pivot gauge."
VOLKSWAGEN PASSAT R36 3.6 V6 A 4WD                     ,  75800 ,       15244 ,   95878 ,13-Mar-2009       ,     5.0 ,          5 , 47041 ,  47041 , 2200 ,    3597 ,"Electric Sports Design Seats, Alcantara Interior With Heated Electric Seats And Sunroof. Multi Function Steering Wheel. 19"" Be By Breyton Sports Rim."
VOLKSWAGEN EOS 2.0 TFSI CSC                            ,  64800 ,       13325 ,  148663 ,02-Mar-2009       ,     4.9 ,          6 , 42075 ,  42075 , 1470 ,    1984 ,Hard Top Cabriolet.Android Touch Screen Audio System.Parking Assist Function.Parking Sensor.Dual Zone Climatic Aircon Control.Electric Memory Seats.
